{
 "pdb_id": "9zi8",
 "entity_id": 1,
 "label_asym_id": "A",
 "auth_asym_id": "A",
 "rfam_acc": "RF00011",
 "sequence_key": "a0368a49e3d059abd960a6638bf64ea4",
 "mapped_region": {
  "start": 8,
  "end": 404
 },
 "alignment": {
  "bit_score": 312.99,
  "avg_pp": 0.944,
  "trunc": "no",
  "cm_from": 1,
  "cm_to": 365
 },
 "summary": {
  "mapped_region_len": 397,
  "n_match": 364,
  "n_insert": 33,
  "n_local_end": 0,
  "cons_span": [
   1,
   365
  ],
  "n_deleted_in_span": 1,
  "n_uncovered_outside_span": 0,
  "fraction_CLEN_matched": 0.9973,
  "n_insertion_sites": 8,
  "longest_insertion": 15,
  "longest_insertion_anchor": 335,
  "pp_star_fraction": 0.8589,
  "pp_below_0.7_count": 34,
  "n_mapped_with_coordinates": 397,
  "n_match_with_coordinates": 364,
  "n_modified_in_mapped": 0,
  "pp_category_counts": {
   "high": 341,
   "medium": 12,
   "low": 44
  }
 },
 "residues": [
  {
   "polymer_seq_position": 1,
   "author_residue_number": 1,
   "author_insertion_code": "",
   "residue_name": "G",
   "nucleotide_parent": "G",
   "is_modified": false,
   "alignment_state": "not_submitted_flank",
   "rfam_consensus_pos": null,
   "insertion_anchor": null,
   "insertion_offset": null,
   "posterior_prob_char": "",
   "posterior_prob": null,
   "has_coordinates": true
  },
  {
   "polymer_seq_position": 2,
   "author_residue_number": 2,
   "author_insertion_code": "",
   "residue_name": "U",
   "nucleotide_parent": "U",
   "is_modified": false,
   "alignment_state": "not_submitted_flank",
   "rfam_consensus_pos": null,
   "insertion_anchor": null,
   "insertion_offset": null,
   "posterior_prob_char": "",
   "posterior_prob": null,
   "has_coordinates": true
  },
  {
   "polymer_seq_position": 3,
   "author_residue_number": 3,
   "author_insertion_code": "",
   "residue_name": "U",
   "nucleotide_parent": "U",
   "is_modified": false,
   "alignment_state": "not_submitted_flank",
   "rfam_consensus_pos": null,
   "insertion_anchor": null,
   "insertion_offset": null,
   "posterior_prob_char": "",
   "posterior_prob": null,
   "has_coordinates": true
  },
  {
   "polymer_seq_position": 4,
   "author_residue_number": 4,
   "author_insertion_code": "",
   "residue_name": "A",
   "nucleotide_parent": "A",
   "is_modified": false,
   "alignment_state": "not_submitted_flank",
   "rfam_consensus_pos": null,
   "insertion_anchor": null,
   "insertion_offset": null,
   "posterior_prob_char": "",
   "posterior_prob": null,
   "has_coordinates": true
  },
  {
   "polymer_seq_position": 5,
   "author_residue_number": 5,
   "author_insertion_code": "",
   "residue_name": "A",
   "nucleotide_parent": "A",
   "is_modified": false,
   "alignment_state": "not_submitted_flank",
   "rfam_consensus_pos": null,
   "insertion_anchor": null,
   "insertion_offset": null,
   "posterior_prob_char": "",
   "posterior_prob": null,
   "has_coordinates": true
  },
  {
   "polymer_seq_position": 6,
   "author_residue_number": 6,
   "author_insertion_code": "",
   "residue_name": "U",
   "nucleotide_parent": "U",
   "is_modified": false,
   "alignment_state": "not_submitted_flank",
   "rfam_consensus_pos": null,
   "insertion_anchor": null,
   "insertion_offset": null,
   "posterior_prob_char": "",
   "posterior_prob": null,
   "has_coordinates": true
  },
  {
   "polymer_seq_position": 7,
   "author_residue_number": 7,
   "author_insertion_code": "",
   "residue_name": "C",
   "nucleotide_parent": "C",
   "is_modified": false,
   "alignment_state": "not_submitted_flank",
   "rfam_consensus_pos": null,
   "insertion_anchor": null,
   "insertion_offset": null,
   "posterior_prob_char": "",
   "posterior_prob": null,
   "has_coordinates": true
  },
  {
   "polymer_seq_position": 8,
   "author_residue_number": 8,
   "author_insertion_code": "",
   "residue_name": "A",
   "nucleotide_parent": "A",
   "is_modified": false,
   "alignment_state": "match",
   "rfam_consensus_pos": 1,
   "insertion_anchor": null,
   "insertion_offset": null,
   "posterior_prob_char": "*",
   "posterior_prob": 0.975,
   "has_coordinates": true
  },
  {
   "polymer_seq_position": 9,
   "author_residue_number": 9,
   "author_insertion_code": "",
   "residue_name": "U",
   "nucleotide_parent": "U",
   "is_modified": false,
   "alignment_state": "match",
   "rfam_consensus_pos": 2,
   "insertion_anchor": null,
   "insertion_offset": null,
   "posterior_prob_char": "*",
   "posterior_prob": 0.975,
   "has_coordinates": true
  },
  {
   "polymer_seq_position": 10,
   "author_residue_number": 10,
   "author_insertion_code": "",
   "residue_name": "G",
   "nucleotide_parent": "G",
   "is_modified": false,
   "alignment_state": "match",
   "rfam_consensus_pos": 3,
   "insertion_anchor": null,
   "insertion_offset": null,
   "posterior_prob_char": "*",
   "posterior_prob": 0.975,
   "has_coordinates": true
  },
  {
   "polymer_seq_position": 11,
   "author_residue_number": 11,
   "author_insertion_code": "",
   "residue_name": "C",
   "nucleotide_parent": "C",
   "is_modified": false,
   "alignment_state": "match",
   "rfam_consensus_pos": 4,
   "insertion_anchor": null,
   "insertion_offset": null,
   "posterior_prob_char": "*",
   "posterior_prob": 0.975,
   "has_coordinates": true
  },
  {
   "polymer_seq_position": 12,
   "author_residue_number": 12,
   "author_insertion_code": "",
   "residue_name": "U",
   "nucleotide_parent": "U",
   "is_modified": false,
   "alignment_state": "match",
   "rfam_consensus_pos": 5,
   "insertion_anchor": null,
   "insertion_offset": null,
   "posterior_prob_char": "*",
   "posterior_prob": 0.975,
   "has_coordinates": true
  },
  {
   "polymer_seq_position": 13,
   "author_residue_number": 13,
   "author_insertion_code": "",
   "residue_name": "C",
   "nucleotide_parent": "C",
   "is_modified": false,
   "alignment_state": "match",
   "rfam_consensus_pos": 6,
   "insertion_anchor": null,
   "insertion_offset": null,
   "posterior_prob_char": "*",
   "posterior_prob": 0.975,
   "has_coordinates": true
  },
  {
   "polymer_seq_position": 14,
   "author_residue_number": 14,
   "author_insertion_code": "",
   "residue_name": "G",
   "nucleotide_parent": "G",
   "is_modified": false,
   "alignment_state": "match",
   "rfam_consensus_pos": 7,
   "insertion_anchor": null,
   "insertion_offset": null,
   "posterior_prob_char": "*",
   "posterior_prob": 0.975,
   "has_coordinates": true
  },
  {
   "polymer_seq_position": 15,
   "author_residue_number": 15,
   "author_insertion_code": "",
   "residue_name": "G",
   "nucleotide_parent": "G",
   "is_modified": false,
   "alignment_state": "match",
   "rfam_consensus_pos": 8,
   "insertion_anchor": null,
   "insertion_offset": null,
   "posterior_prob_char": "*",
   "posterior_prob": 0.975,
   "has_coordinates": true
  },
  {
   "polymer_seq_position": 16,
   "author_residue_number": 16,
   "author_insertion_code": "",
   "residue_name": "G",
   "nucleotide_parent": "G",
   "is_modified": false,
   "alignment_state": "match",
   "rfam_consensus_pos": 9,
   "insertion_anchor": null,
   "insertion_offset": null,
   "posterior_prob_char": "*",
   "posterior_prob": 0.975,
   "has_coordinates": true
  },
  {
   "polymer_seq_position": 17,
   "author_residue_number": 17,
   "author_insertion_code": "",
   "residue_name": "U",
   "nucleotide_parent": "U",
   "is_modified": false,
   "alignment_state": "match",
   "rfam_consensus_pos": 10,
   "insertion_anchor": null,
   "insertion_offset": null,
   "posterior_prob_char": "*",
   "posterior_prob": 0.975,
   "has_coordinates": true
  },
  {
   "polymer_seq_position": 18,
   "author_residue_number": 18,
   "author_insertion_code": "",
   "residue_name": "A",
   "nucleotide_parent": "A",
   "is_modified": false,
   "alignment_state": "match",
   "rfam_consensus_pos": 11,
   "insertion_anchor": null,
   "insertion_offset": null,
   "posterior_prob_char": "*",
   "posterior_prob": 0.975,
   "has_coordinates": true
  },
  {
   "polymer_seq_position": 19,
   "author_residue_number": 19,
   "author_insertion_code": "",
   "residue_name": "A",
   "nucleotide_parent": "A",
   "is_modified": false,
   "alignment_state": "match",
   "rfam_consensus_pos": 12,
   "insertion_anchor": null,
   "insertion_offset": null,
   "posterior_prob_char": "*",
   "posterior_prob": 0.975,
   "has_coordinates": true
  },
  {
   "polymer_seq_position": 20,
   "author_residue_number": 20,
   "author_insertion_code": "",
   "residue_name": "U",
   "nucleotide_parent": "U",
   "is_modified": false,
   "alignment_state": "match",
   "rfam_consensus_pos": 13,
   "insertion_anchor": null,
   "insertion_offset": null,
   "posterior_prob_char": "*",
   "posterior_prob": 0.975,
   "has_coordinates": true
  },
  {
   "polymer_seq_position": 21,
   "author_residue_number": 21,
   "author_insertion_code": "",
   "residue_name": "C",
   "nucleotide_parent": "C",
   "is_modified": false,
   "alignment_state": "match",
   "rfam_consensus_pos": 14,
   "insertion_anchor": null,
   "insertion_offset": null,
   "posterior_prob_char": "*",
   "posterior_prob": 0.975,
   "has_coordinates": true
  },
  {
   "polymer_seq_position": 22,
   "author_residue_number": 22,
   "author_insertion_code": "",
   "residue_name": "G",
   "nucleotide_parent": "G",
   "is_modified": false,
   "alignment_state": "match",
   "rfam_consensus_pos": 15,
   "insertion_anchor": null,
   "insertion_offset": null,
   "posterior_prob_char": "*",
   "posterior_prob": 0.975,
   "has_coordinates": true
  },
  {
   "polymer_seq_position": 23,
   "author_residue_number": 23,
   "author_insertion_code": "",
   "residue_name": "C",
   "nucleotide_parent": "C",
   "is_modified": false,
   "alignment_state": "match",
   "rfam_consensus_pos": 16,
   "insertion_anchor": null,
   "insertion_offset": null,
   "posterior_prob_char": "*",
   "posterior_prob": 0.975,
   "has_coordinates": true
  },
  {
   "polymer_seq_position": 24,
   "author_residue_number": 24,
   "author_insertion_code": "",
   "residue_name": "U",
   "nucleotide_parent": "U",